jrevels/Cassette.jl, 2017, 2018, 2019, 2020
Number of GitHub stars, 50, 150 (+200%), 232 (+55%), 280 (+21%)
Number of registered dependent packages, 0, 0, 16, 20 (+25%)
Cumulative GitHub stars of dependent packages, 0, 0, 759, 1074 (+42%)
Number of GitHub issues, 17, 57 (+235%), 86 (+51%), 100 (+16%)
Number of GitHub pull requests, 7, 41 (+486%), 68 (+66%), 80 (+18%)
Number of users who have opened a GitHub issue, 2, 15 (+650%), 30 (+100%), 35 (+17%)
Number of users who have opened a GitHub pull requests, 3, 8 (+167%), 13 (+62%), 18 (+38%)
